{
  "app_url": "https://prometheus-e83j.onrender.com",
  "extraction_date": "2026-04-22",
  "source": "visual-audit",
  "colors": {
    "brand": [
      {
        "name": "brand-blue-light",
        "value": "rgb(34,139,230)",
        "usage": "Primary action color in light theme — Execute button, active nav links, info callout accents. Mantine blue[6].",
        "figma_rgb": { "r": 0.133, "g": 0.545, "b": 0.902 }
      },
      {
        "name": "brand-blue-dark",
        "value": "rgb(25,113,194)",
        "usage": "Primary action color in dark theme — Execute button fill. Mantine blue[8].",
        "figma_rgb": { "r": 0.098, "g": 0.443, "b": 0.761 }
      },
      {
        "name": "nav-slate",
        "value": "rgb(65,73,81)",
        "usage": "Fixed top navbar background. Identical in light and dark themes — a deliberate product-brand anchor.",
        "figma_rgb": { "r": 0.255, "g": 0.286, "b": 0.318 }
      }
    ],
    "status": [
      {
        "name": "ok",
        "light": {
          "bg": "rgb(211,249,216)",
          "text": "rgb(43,138,62)",
          "border": "transparent"
        },
        "dark": {
          "bg": "rgb(43,138,62)",
          "text": "rgb(211,249,216)",
          "border": "transparent"
        }
      },
      {
        "name": "error",
        "light": {
          "bg": "rgb(255,245,245)",
          "text": "rgb(201,42,42)",
          "border": "transparent"
        },
        "dark": {
          "bg": "rgb(201,42,42)",
          "text": "rgb(255,245,245)",
          "border": "transparent"
        }
      },
      {
        "name": "info",
        "light": {
          "bg": "rgba(34,139,230,0.1)",
          "text": "rgb(24,100,171)",
          "border": "transparent"
        },
        "dark": {
          "bg": "rgba(34,139,230,0.15)",
          "text": "rgb(116,192,252)",
          "border": "transparent"
        }
      }
    ],
    "surface": [
      {
        "name": "page-bg",
        "light": "rgb(255,255,255)",
        "dark": "rgb(36,36,36)"
      },
      {
        "name": "card-bg",
        "light": "rgb(255,255,255)",
        "dark": "rgb(46,46,46)"
      },
      {
        "name": "nav-bg",
        "light": "rgb(65,73,81)",
        "dark": "rgb(65,73,81)"
      },
      {
        "name": "label-badge-bg",
        "light": "rgb(241,243,245)",
        "dark": "rgb(52,58,64)"
      },
      {
        "name": "stats-badge-bg",
        "light": "rgb(241,243,245)",
        "dark": "rgb(52,58,64)"
      }
    ],
    "text": [
      {
        "name": "primary",
        "light": "rgb(0,0,0)",
        "dark": "rgb(201,201,201)"
      },
      {
        "name": "inverted",
        "light": "rgb(255,255,255)",
        "dark": "rgb(255,255,255)"
      },
      {
        "name": "muted",
        "light": "rgb(134,142,150)",
        "dark": "rgb(134,142,150)"
      },
      {
        "name": "info-callout",
        "light": "rgb(24,100,171)",
        "dark": "rgb(116,192,252)"
      },
      {
        "name": "label-badge",
        "light": "rgb(52,58,64)",
        "dark": "rgb(173,181,189)"
      }
    ],
    "border": [
      {
        "name": "default",
        "light": "rgb(222,226,230)",
        "dark": "rgb(66,66,66)"
      },
      {
        "name": "nav",
        "light": "rgb(65,73,81)",
        "dark": "rgb(65,73,81)"
      }
    ]
  },
  "spacing": {
    "scale": [
      { "name": "xs", "value_px": 4, "value_rem": 0.25 },
      { "name": "sm", "value_px": 8, "value_rem": 0.5 },
      { "name": "sm-lg", "value_px": 12, "value_rem": 0.75 },
      { "name": "md", "value_px": 16, "value_rem": 1 },
      { "name": "lg", "value_px": 24, "value_rem": 1.5 }
    ],
    "layout": [
      { "name": "card-padding", "value_px": 16 },
      { "name": "navbar-height", "value_px": 56 }
    ]
  },
  "typography": {
    "families": [
      {
        "name": "body",
        "family": "-apple-system, BlinkMacSystemFont, 'Segoe UI', Roboto, Helvetica, Arial, sans-serif",
        "usage": "All prose, labels, table cells, badge text — the Mantine default system sans-serif stack.",
        "figma_family": "Inter"
      },
      {
        "name": "mono",
        "family": "monospace",
        "usage": "Code blocks (/config YAML), flag names (<code> tags on /flags). Currently browser-default monospace with no explicit stack — see INC-009.",
        "figma_family": "Courier New"
      }
    ],
    "styles": [
      {
        "name": "heading/card-title",
        "category": "heading",
        "font_family": "body",
        "size_px": 18,
        "size_rem": 1.125,
        "weight": 600,
        "line_height": 1.4,
        "letter_spacing": null
      },
      {
        "name": "heading/section",
        "category": "heading",
        "font_family": "body",
        "size_px": 16,
        "size_rem": 1,
        "weight": 600,
        "line_height": 1.4,
        "letter_spacing": null
      },
      {
        "name": "body/default",
        "category": "body",
        "font_family": "body",
        "size_px": 14,
        "size_rem": 0.875,
        "weight": 400,
        "line_height": 1.55,
        "letter_spacing": null
      },
      {
        "name": "label/button",
        "category": "label",
        "font_family": "body",
        "size_px": 14,
        "size_rem": 0.875,
        "weight": 600,
        "line_height": 1,
        "letter_spacing": null
      },
      {
        "name": "label/badge",
        "category": "label",
        "font_family": "body",
        "size_px": 12,
        "size_rem": 0.75,
        "weight": 400,
        "line_height": 1,
        "letter_spacing": null
      },
      {
        "name": "code/block",
        "category": "code",
        "font_family": "mono",
        "size_px": 16,
        "size_rem": 1,
        "weight": 400,
        "line_height": 1.5,
        "letter_spacing": null
      },
      {
        "name": "code/inline",
        "category": "code",
        "font_family": "mono",
        "size_px": 14,
        "size_rem": 0.875,
        "weight": 400,
        "line_height": 1,
        "letter_spacing": null
      }
    ]
  },
  "border_radius": [
    { "name": "sm", "value_px": 4 },
    { "name": "pill", "value_px": 1000 },
    { "name": "pill-max", "value_px": 16000 }
  ],
  "elevation": [
    {
      "name": "card",
      "light": {
        "css": "0 1px 3px rgba(0,0,0,0.05), 0 1px 2px rgba(0,0,0,0.1)",
        "figma_effects": [
          {
            "type": "DROP_SHADOW",
            "color": { "r": 0, "g": 0, "b": 0, "a": 0.05 },
            "offset": { "x": 0, "y": 1 },
            "radius": 3,
            "spread": 0
          },
          {
            "type": "DROP_SHADOW",
            "color": { "r": 0, "g": 0, "b": 0, "a": 0.1 },
            "offset": { "x": 0, "y": 1 },
            "radius": 2,
            "spread": 0
          }
        ]
      },
      "dark": {
        "css": "0 1px 3px rgba(0,0,0,0.05), 0 1px 2px rgba(0,0,0,0.1)",
        "figma_effects": [
          {
            "type": "DROP_SHADOW",
            "color": { "r": 0, "g": 0, "b": 0, "a": 0.05 },
            "offset": { "x": 0, "y": 1 },
            "radius": 3,
            "spread": 0
          },
          {
            "type": "DROP_SHADOW",
            "color": { "r": 0, "g": 0, "b": 0, "a": 0.1 },
            "offset": { "x": 0, "y": 1 },
            "radius": 2,
            "spread": 0
          }
        ]
      }
    }
  ],
  "icons": {
    "library": "Tabler Icons",
    "count": 12,
    "default_size_px": 18,
    "icons": [
      { "name": "database", "usage": "Build information card title on /status", "svg": null },
      { "name": "run", "usage": "Runtime information card title on /status", "svg": null },
      { "name": "bell", "usage": "Active Alertmanagers card title on /alertmanager-discovery", "svg": null },
      { "name": "bell-off", "usage": "Dropped Alertmanagers card title on /alertmanager-discovery", "svg": null },
      { "name": "sun", "usage": "Theme toggle — switch to light mode (navbar)", "svg": null },
      { "name": "moon", "usage": "Theme toggle — switch to dark mode (navbar)", "svg": null },
      { "name": "settings", "usage": "Settings ActionIcon in navbar", "svg": null },
      { "name": "book", "usage": "Docs link ActionIcon in navbar", "svg": null },
      { "name": "clipboard", "usage": "Copy-to-clipboard ActionIcon on /config card", "svg": null },
      { "name": "chevron-up", "usage": "Sort ascending indicator in sortable table header (/flags)", "svg": null },
      { "name": "chevron-down", "usage": "Sort descending indicator in sortable table header (/flags)", "svg": null },
      { "name": "search", "usage": "Leading affix icon in single-field filter input (/flags)", "svg": null }
    ]
  }
}
